{
  "level": {
    "episode": 1,
    "level": 5,
    "difficulty": 2
  },
  "counter": 0,
  "session": "736e492a4461b02e7264892b",
  "type": "start_level",
  "frame": {
    "millis": 5462,
    "tic": 191
  },
  "actor": {
    "position": {
      "x": -14680064,
      "y": -40894464,
      "z": 0,
      "angle": 1073741824,
      "subsector": 5261842056
    },
    "type": "player",
    "health": 100,
    "armor": 0,
    "id": 5261970112
  }
}